Sr No.,NAMC_ID,NAMC_CODE,NAMC_term,NAMC_term_diacritical,NAMC_term_DEVANAGARI,Short_definition,Long_definition,Ontology_branches,Name_English,Name_English_Under_Index
660,667,EB-11.11,kShunninirodhaja-udAvartaH,kṣunninirōdhaja-udāvartaḥ,क्षुन्निनिरोधज-उदावर्तः,-,"the disorder is characterized by tandrā [drowsiness/lassitude], aṅgamardaḥ [generalised bodyache], aruciḥ [tastelessness], vibhramaḥ [dizziness/confusion], dr̥ṣṭi-kr̥śatā [diminished vision], śramaḥ [exhaustion/fatigue]",-,udāvarta due to suppression of hunger,-
661,668,EB-11.12,tRuShNAnirodhaja-udAvartaH,tr̥ṣṇānirōdhaja-udāvartaḥ,तृष्णानिरोधज-उदावर्तः,-,"the disorder is characterized by kaṇṭha-śōṣaḥ [dryness in the throat], āsyaśōṣaḥ [dryness in mouth], śravaṇāvarōdhaḥ [difficilty in hearing], hr̥dayē vyathā [pain/distress in the pericordium]",-,udāvarta due to suppression of thirst,-
662,669,EB-11.13,SvAsanirodhaja-udAvartaH/SramaSvAsavegarodha-janyodAvartaH,śvāsanirōdhaja-udāvartaḥ/śramaśvāsavēgarōdha-janyōdāvartaḥ,श्वासनिरोधज-उदावर्तः/श्रमश्वासवेगरोध-जन्योदावर्तः,-,"the disorder is characterized by hr̥drōgaḥ [diseases of heart], mōhaḥ [confusion/delirium], gulmaḥ [palpable glandular enlargment in abdomen/abdominal lump]",-,udāvarta due to suppression of respiration,-
663,670,EB-11.14,nidrArodhaja-udAvartaH,nidrārōdhaja-udāvartaḥ,निद्रारोधज-उदावर्तः,-,"the disorder is characterized by jr̥mbhā [yawning], aṅgamardaḥ [generalised bodyache], aṅgajāḍyam [rigidity/stiffness of the body], akṣyatijāḍyam [excessive heaviness of the eyes], śirōऽtijāḍyam [excessive heaviness of the head], tandrā [drowsiness/lassitude]",-,udāvarta due to suppression of sleep,-
664,671,EB-11.15,kAsAvarodhaja-udAvartaH,kāsāvarōdhaja-udāvartaḥ,कासावरोधज-उदावर्तः,-,-,-,udāvarta due to suppression of cough,-
665,672,EB-11.16,SramaSvAsavegarodhaja-udAvartaH,śramaśvāsavēgarōdhaja-udāvartaḥ,श्रमश्वासवेगरोधज-उदावर्तः,-,the disorder is characterized by hr̥drōga [diseases of heart],-,udāvarta due to suppression of breathlessness due to exertion,-
666,673,EB-11.17,rUkShAdiBojana-nimittodAvartaH,rūkṣādibhōjana-nimittōdāvartaḥ,रूक्षादिभोजन-निमित्तोदावर्तः,-,"the disorder is characterized by hr̥cchūlaḥ [pain in the precordium/cardiac region], bastiśūlaḥ [pain in basti/urinary bladder], hr̥llāsaḥ [nausea], aratiḥ [distress/dicontent/restlessness], kr̥chrēṇa vātapravr̥ttiḥ [difficulty in passing flatus], kr̥chrēṇa mūtrapravr̥ttiḥ [difficulty in micturition], kr̥chrēṇa purīṣapravr̥ttiḥ [difficulty in defecation], śvāsaḥ [breathlessness/difficult breathing], kāsaḥ [cough], pratiśyāyaḥ [cold, catarrh], dāhaḥ [burning sensation], mōhaḥ [confusion/delirium], tr̥ṣā [thirst], jvaraḥ [fever], vamiḥ [vomiting], hikkā [hiccup], śirōrōgaḥ [diseases of the head], manōvibhramaḥ [confusion of mind], śravaṇavibhramaḥ [disturbance of hearing], purīṣaṁ cātivartayēt [increased frequency of stools/defecation]",-,udāvarta due to dry food,-
667,674,EB-11.18,asAdhya-udAvartaH,asādhya-udāvartaḥ,असाध्य-उदावर्तः,-,"the disorder is characterized by tr̥ṣṇā [thirst], arditaḥ [facial paralysis], pariklēśaḥ [fatigue], kṣīṇaḥ [weakness], śūlaḥ [colicky pain in the abdomen], śakr̥d vamanam [vomiting of faecal matter]",-,irremediable udāvarta,-
668,675,EB-11.19,udAvarta-upadravaH,udāvarta-upadravaḥ,उदावर्त-उपद्रवः,-,-,-,complications of udāvarta,-
669,676,EB-12,parikartikA,(a) parikartikā,परिकर्तिका,-,"It is characterised by cutting type of pain with burning sensation in anal region, streak like blood mixed stools, may be associated with pain radiating to umbilicus, genitals, bladder. This may be explained by: (a) Injury, deranged digestive and metabolic factors leading to vitiation of skin, blood, muscle, fat tissue.",-,Anal fissure disorder (TM2),-
670,677,EB-13,antardAhaH,,अन्तर्दाहः,-,-,-,burning stomach pain,-
671,678,EB-14,purIShavaha-srotoduShTi,(a) purīṣavahasrotoduṣṭiḥ,पुरीषवह-स्रोतोदुष्टि,-,"It is characterized by difficulty in defecation, scanty defecation, defecation with sound, painful defecation, defecating watery stools, defecating scybalous, hard stools, defecating large volume stools. This may be explained by derangement of channels (functional or anatomical or both) of feces.",-,Derangement of channels of faeces pattern (TM2),-
672,679,EC,rasavahasrotovikAraH,,रसवहस्रोतोविकारः,-,-,-,disorders of rasavaha srōtas,-
673,680,EC-1,rasavahasrotoduShTiH,,रसवहस्रोतोदुष्टिः,-,-,-,derangement of channels-rasavaha srōtas,-
674,681,EC-2,hRudrogaH,(a) hṛdrogaḥ,हृद्रोगः,-,"It is characterised by chest pain, discomfort, palpitation, fatigue, dyspnoea, swelling and coldness of lower limbs. This may be explained by: (a) Vitiated dosha affected primary product of digested food further affecting the heart.",-,Heart pain disorder (TM2),-
675,682,EC-2.1,vAtajahRudrogaH,vātajahr̥drōgaḥ,वातजहृद्रोगः,-,"the disorder is characterized by uttamarujā/atyarthaṁ śūlaḥ [severe pain], vēpathuḥ [shivering/tremors], vēṣṭanam [feeling as if wrapped/cramps], stambhaḥ [rigidity/stiffness], pramōhaḥ/mōhaḥ [fainting/severe confusion], śūnyatā/hr̥dayaśūnyatā [feeling of hollowness], daraḥ [fear], jīrṇē atyarthavēdnā [severe pain], āyamyatē [feeling of stretching], tudyatē hr̥dayam [pricking pain in the heart], nirmathyatē hr̥dayam [churning pain in the heart], dīryatē hr̥dayam [tearing pain in the heart], sphōṭyatē hr̥dayam/sphuṭatīva hr̥dayam [bursting pain in the heart], pāṭyatē hr̥dayam [splitting pain in the heart], bhidyatē hr̥dayam [breaking type of pain in the heart], śuṣyati hr̥dayam [depletion/drying up in the heart], stabdhahr̥dayam [feeling as if heart is stiff, rigid], dravaḥ [palpitation], akasmāt dīnatā [sudden distress/fear], śōkāsahiṣṇutā [intolerance to grief], bhayāsahiṣṇutā [intolerance to fear], śabdāsahiṣṇutā [intolerance to sound], śvāsarōdhaḥ [obstruction to breathing], alpanidratā [sleeplessness]",-,hr̥drōga due to vāta,-
676,683,EC-2.2,pittajahRudrogaH,pittajahr̥drōgaḥ,पित्तजहृद्रोगः,-,"the disorder is characterized by hr̥ddāhaḥ [burning sensation in the precordial/cardiac region], tiktatā vaktrē [bitter taste in mouth], ti094ḍ;ktōdgiraṇam [bitter erructation], amlōdgiraṇam [sour belching/eructation], klamaḥ [exhaustion without exertion], tr̥ṣṇā [thirst], mūrchā [syncope/attacks of swooning], bhramaḥ [giddiness or dizziness], svēdaḥ [perspiration], ūṣā [burning sensation with sweating and restlessness], dāhaḥ [burning sensation], cōṣaḥ [sucking type of pain], hr̥dayaklamaḥ [fatigue in the heart], dhūmāyanam/dhūmakaḥ [smoky eructation], mūrcchā [syncope/attacks of swooning], mukha-śōṣaḥ [dryness of mouth], amlacchardanam [sour vomitus], pittacchardanam [vomiting of pitta], pītatā [yellowish discolouration], jvaraḥ [fever]",-,hr̥drōga due to pitta,-
677,684,EC-2.3,kaPajahRudrogaH,kaphajahr̥drōgaḥ,कफजहृद्रोगः,-,"the disorder is characterized by suptahr̥dayam [feeling as if heart is numb], stimitahr̥dayam [feeling as if heart is wrapped with wet cloth], bhārikaṁ hr̥dayam [feeling of heaviness in heart], tandrā [drowsiness/lassitude], aruciḥ [tastelessness], hr̥dayam aśmāvr̥taṁ yathā/aśmagarbhavat hr̥dayam [feel heart as stony hard], gauravam [heaviness], kaphasaṁsrāvaḥ [secretion of mucus], aruciḥ [tastelessness], stambhaḥ [rigidity/stiffness], agnimārdavam [diminution of agni (digestive power)], āsyamādhuryam [sweetness in mouth], balāsāvatatē hr̥di [lassitude], stabdhahr̥dayam [feeling as if heart is stiff, rigid], kāsaḥ [cough], agnisādaḥ [diminution of agni (digestive power)], niṣṭhīvanam [spitting], nidrā [sleep], ālasyam [lethargy], jvaraḥ [fever]",-,hr̥drōga due to kapha,-
678,685,EC-2.4,sAnnipAtajahRudrogaH,sānnipātajahr̥drōgaḥ,सान्निपातजहृद्रोगः,-,"the disorder is characterized by saṁsargalakṣaṇam [clinical features of two doshas], sarvaliṁgam [clinical features of all types of dōṣa]",-,hr̥drōga due to three dōṣa,-
679,686,EC-2.5,kRumijahRudrogaH,kr̥mijahr̥drōgaḥ,कृमिजहृद्रोगः,-,"the disorder is characterized by granthiḥ [glandular swellings], marmadēśē saṁklēdaḥ [increased klēda (moisture or suitable envoirnment for kr̥mi) in heart], kr̥miḥ [worms], hr̥dayaṁ sūcībhiḥ tudyamānam iva manyatē [feels as if heart is pierced by needles], hr̥dayaṁ śastraiḥ chidyamānamiva manyatē [feels as if heart is cut by knife], kaṇḍūḥ [itching], mahārujā [severe pain], sudāruṇaḥ [sever form], utklēśaḥ [nausea/provocation of dōṣa], ṣṭhīvanam [spitting/excess expectoration], tōdaḥ/tīvratōdaḥ [pricking pain], śūlaḥ [colicky pain in the abdomen], hr̥llāsaḥ [nausea], tamaḥ [blackouts], aruciḥ [tastelessness], śyāvanētratvam [dark brown dis colouration of the eyes], śōṣaḥ [dryness/wasting/emaciation], śyāvanētratā [dark brown dis colouration of the eyes], tamaḥ pravēśaḥ [feels as entering into darkness], kaphasrutiḥ [salivation of kapha], hr̥dayaṁ pratataṁ krakacēnaiva dāryatē [heart is cutting by saw constantly], tīvrartiḥ [severe distress], utklēdaḥ [nausea/provocation of dōṣa], śōthaḥ [swelling/oedema]",-,hr̥drōga due to infestation,-
680,687,EC-2.6,hRut-SUlaH,hr̥t-śūlaḥ,हृत्-शूलः,-,"the disorder is characterized by śūlaḥ [sharp pain], ucchvāsarōdhaḥ [restricted expiration]",-,cardialgia,-
681,688,EC-2.7,hRudroga-upadravaH,hr̥drōga-upadravaḥ,हृद्रोग-उपद्रवः,-,"the disorder is characterized by bhramaḥ [giddiness or dizziness], klamaḥ [exhaustion without exertion], sāda [exhaustion or tirednes of body], śōṣaḥ [dryness/wasting/emaciation], śōthaḥ [oedema]",-,complications of hr̥drōga,-
682,689,EC-3,jvaraH,(a) jvara,ज्वरः,-,It is characterised by increased body temperature leading to disturbance in normal functions of the body. This may be explained by: (a) Any of the three dosha affecting the primary product of digested food.,-,Fever disorder (TM2),-
683,690,EC-3.1,jvara-pUrvarupam,,ज्वर-पूर्वरुपम्,-,-,-,prodromes of jvara,-
684,691,EC-3.2,vAtikajvaraH,(a) vātikajvaraḥ,वातिकज्वरः,-,"It is characterised by body pain, blackish discoloration of body, irregular fever, constipation. This may be explained by: (a) Increased vata affecting the primary product of digested food and leading to weakness of digestive and metabolic factors.",-,Fever with body pain disorder (TM2),-
685,692,EC-3.2.1,vAtikajvara-pUrvarUpam,,वातिकज्वर-पूर्वरूपम्,-,-,-,prodromes of jvara due to vāta,-
686,693,EC-3.3,paittikajvaraH,(a) paittikajvaraḥ,पैत्तिकज्वरः,-,"It is characterised by high fever, dizziness, yellowish, reddish discoloration of various body parts, excessive thirst, bitter taste in mouth. This may be explained by: (a) Increased pitta affecting the primary product of digested food and leading to weakness of digestive and metabolic factors.",-,High fever disorder with yellow discouloration (TM2),-
687,694,EC-3.3.1,paittikajvaraH-pUrvarUpam,paittikajvaraḥ-pūrvarūpam,पैत्तिकज्वरः-पूर्वरूपम्,-,the disorder is characterized by nayanayōrdāhaḥ [burning sensation in eyes],-,prodromes of jvara due to pitta,-
688,695,EC-3.4,kaPajajvaraH,(a) kaphajajvaraḥ,कफजज्वरः,-,"It is characterised by persistent low grade fever associated with indigestion, heaviness, decreased thirst, excessive salivation, weakness, expectoration. This may be explained by: (a) increased kapa dosha affecting the primary product of digested food and leading to weakness of digestive and metabolic factors.",-,Fever disorder with excessive salivation (TM2),-
689,696,EC-3.4.1,kaPajajvara-pUrvarUpam,,कफजज्वर-पूर्वरूपम्,-,-,-,prodromaes of jvara due to kapha,-
690,697,EC-3.5,kaPavAtajajvaraH,(a) kaphavātajajvaraḥ,कफवातजज्वरः,-,-,-,Fever disorder due to Kapha and Vata (TM2) ⇒,-
691,698,EC-3.6,vAtapittajajvaraH,(a) vātapittajajvaraḥ,वातपित्तजज्वरः,-,-,-,Fever disorder due to Vāta and Pitta (TM2) ⇒,-
692,699,EC-3.7,kaPapittajajvaraH,(a) kaphapittajajvaraḥ,कफपित्तजज्वरः,-,-,-,Fever disorder due to Kapha and Pitta (TM2) ⇒,-
693,700,EC-3.8,sannipAtajajvaraH,(a) sannipātajajvaraḥ,सन्निपातजज्वरः,-,-,-,Fever disorder due to vitiation of all the three dosha (TM2) ⇒,-
694,701,EC-3.8.1,vAtolbaNasAnnipAtajvaraH,vātōlbaṇasānnipātajvaraḥ,वातोल्बणसान्निपातज्वरः,-,"the disorder is characterized by sandhiśūlam [pain in the joints], asthiśūlam [pain in the bones], śiraḥśūlam [headache], pralāpaḥ [excess talking/irrelevant speech/incoherent speech], gauravam [heaviness of body], bhramaḥ [giddiness or dizziness], tuṣṇā [thirst], kaṇṭhaśuṣkatā [dryness of throat], āsyaśuṣkatā [dryness in mouth]",-,vāta predominant sannipātajvara,-
695,702,EC-3.8.2,pittolbaNasannipAtajvaraH,pittōlbaṇasannipātajvaraḥ,पित्तोल्बणसन्निपातज्वरः,-,"the disorder is characterized by raktaviṭ [reddish faeces], raktamūtratā [urine with blood, blood coloured urine/hematuria], dāhaḥ [burning sensation all over body], svēdaḥ [perspiration], tr̥ṭ [thirst], balasaṁkṣayaḥ [loss of strength], mūrcchā [syncope/attacks of swooning]",-,pitta predominant sannipātajvara,-
696,703,EC-3.8.3,kaPolbaNa-sAnnipAtajvaraH,kaphōlbaṇa-sānnipātajvaraḥ,कफोल्बण-सान्निपातज्वरः,-,"the disorder is characterized by ālasyam [lethargy], aruciḥ [tastelessness], hr̥llāsaḥ [nause], dāhaḥ [burning sensation], vami [vomiting], aratiḥ [distress/dicontent/restlessness], bhramaḥ [giddiness or dizziness], tandrā [drowsiness/lassitude], kāsaḥ [cough]",-,kapha predominant sannipātajvara,-
697,704,EC-3.8.4,vAtapittolbaNa-sannipAtajvaraH,vātapittōlbaṇa-sannipātajvaraḥ,वातपित्तोल्बण-सन्निपातज्वरः,-,"the disorder is characterized by bhramaḥ [giddiness or dizziness], pipāsā [thirst], dāhaḥ [burning sensation], gauravam [heaviness of body], śirasaḥ atiruk [severe headache]",-,vāta-pitta predominant sannipātajvara,-
698,705,EC-3.8.5,vAtakaPolbaNa-sannipAtajvaraH,vātakaphōlbaṇa-sannipātajvaraḥ,वातकफोल्बण-सन्निपातज्वरः,-,"the disorder is characterized by śaityam [coldness], kāsaḥ [cough], aruciḥ [tastelessness], tandrā [drowsiness/lassitude], pipāsā [thirst], dāhaḥ [burning sensation], ruk [pain]",-,vāta-kapha predominant sannipātajvara,-
699,706,EC-3.8.6,pittakaPolbaNa-sannipAtajvaraH,pittakaphōlbaṇa-sannipātajvaraḥ,पित्तकफोल्बण-सन्निपातज्वरः,-,"the disorder is characterized by chardiḥ [vomiting], muhuḥ śaityam muhuḥ dāhaḥ [on and off chills and burning], tr̥ṣṇā [thirst], mōhaḥ [confusion/delirium], asthivēdanā [bone pain]",-,pitta-kapha predominant sannipātajvara,-
700,707,EC-3.8.7,hInavAta-madhyapitta-vRuddhakaPa-sannipAtajvaraH,hīnavāta-madhyapitta-vr̥ddhakapha-sannipātajvaraḥ,हीनवात-मध्यपित्त-वृद्धकफ-सन्निपातज्वरः,-,"the disorder is characterized by pratiśyāyaḥ [cold, catarrh], chardiḥ [vomiting], ālasyam [lethargy], tandrā [drowsiness/lassitude], aruciḥ [tastelessness], agnimārdavam [diminution of agni (digestive power)]",-,"vāta-depleted, pitta-aggravated, kapha-highly aggravated sannipātajvara",-
701,708,EC-3.8.8,hInavAta-madhyakaPa-vRuddhapitta-sannipAtajvaraH,hīnavāta-madhyakapha-vr̥ddhapitta-sannipātajvaraḥ,हीनवात-मध्यकफ-वृद्धपित्त-सन्निपातज्वरः,-,"the disorder is characterized by hāridranētratvam [yellow coloured eyes], hāridramūtratvam [yellowish discoluration of urine], dāhaḥ [burning sensation], tr̥ṣṇā [thirst], bhramaḥ [giddiness or dizziness], aruciḥ [tastelessness]",-,"vāta-depleted, kapha-aggravated, pitta-highly aggravated sannipātajvara",-
702,709,EC-3.8.9,hInapitta-madhyavAta-vRuddhakaPa-sannipAtajvaraH,hīnapitta-madhyavāta-vr̥ddhakapha-sannipātajvaraḥ,हीनपित्त-मध्यवात-वृद्धकफ-सन्निपातज्वरः,-,"the disorder is characterized by śītakaḥ [chills], gauravam [heaviness], tandrā [drowsiness/lassitude], pralāpaḥ [excess talking/irrelevant speech/incoherent speech], asthinaḥ atiruk [severe pain in bone], śirōsaḥ atiruk [severe headache]",-,"pitta-depleted, vāta-aggravated, kapha-highly aggravated sannipātajvara",-
703,710,EC-3.8.10,hInapitta-madhyakaPa-vRuddhavAta-sannipAtajvaraH,hīnapitta-madhyakapha-vr̥ddhavāta-sannipātajvaraḥ,हीनपित्त-मध्यकफ-वृद्धवात-सन्निपातज्वरः,-,"the disorder is characterized by śirōruk [headache], vēpathuḥ [shivering/tremors], śvāsaḥ [breathlessness/difficult breathing], pralāpaḥ [excess talking/irrelevant speech/incoherent speech], chardiḥ [vomiting], arōcakaḥ [tastelessnes]",-,"pitta-depleted, kapha-aggravated, vāta-highly aggravated sannipātajvara",-
704,711,EC-3.8.11,hInakaPa-madhyavAta-vRuddhapitta-sannipAtajvaraH,hīnakapha-madhyavāta-vr̥ddhapitta-sannipātajvaraḥ,हीनकफ-मध्यवात-वृद्धपित्त-सन्निपातज्वरः,-,"the disorder is characterized by varcōbhēdaḥ [diarrhoea/loose motions], agnidaurbalyam [diminution of agni], tr̥ṣṇā [thirst], dāhaḥ [burning sensation], aruciḥ [tastelessness], bhramaḥ [giddiness or dizziness]",-,"kapha-depleted, vāta-aggravated, pitta-highly aggravated sannipātajvara",-
705,712,EC-3.8.12,hInakaPa-madhyapitta-vRuddhavAta-sannipAtajvaraH,hīnakapha-madhyapitta-vr̥ddhavāta-sannipātajvaraḥ,हीनकफ-मध्यपित्त-वृद्धवात-सन्निपातज्वरः,-,"the disorder is characterized by śvāsaḥ [breathlessness/difficult breathing], kāsaḥ [cough], pratiśyāyaḥ [cold, catarrh], mukhaśōṣaḥ [dryness of mouth], atipārśvaruk [severe pain in flanks]",-,"kapha-depleted, pitta-aggravated, vāta-highly aggravated sannipātajvara",-
706,713,EC-3.8.13,vAtapittakaPavRuddha-sannipAtajvaraH,vātapittakaphavr̥ddha-sannipātajvaraḥ,वातपित्तकफवृद्ध-सन्निपातज्वरः,-,the disorder is characterized by sannipātajvarasya liṁgam [],-,jvara due to aggrevatedthree dōṣa,-
707,714,EC-3.8.14,prorNunAva-sAnnipAtajajvaraH,prōrṇunāva-sānnipātajajvaraḥ,प्रोर्णुनाव-सान्निपातजज्वरः,-,-,-,sannipātajvara (fever) recurring before it is completely treated,-
708,715,EC-3.8.15,pralApI-sAnnipAtajajvaraH,pralāpī-sānnipātajajvaraḥ,प्रलापी-सान्निपातजज्वरः,-,-,-,sannipātajvara with pralāpa,-
709,716,EC-3.8.16,antardAhi-sannipAtajvaraH,antardāhi-sannipātajvaraḥ,अन्तर्दाहि-सन्निपातज्वरः,-,-,-,sannipātajvara with antardāha,-
710,717,EC-3.8.17,daNDapAta-sAnnipAtajajvaraH,daṇḍapāta-sānnipātajajvaraḥ,दण्डपात-सान्निपातजज्वरः,-,-,-,daNDapAta- sannipātajvara,-
711,718,EC-3.8.18,antaka-sannipAtajvaraH,antaka-sannipātajvaraḥ,अन्तक-सन्निपातज्वरः,-,-,-,āntaka- sannipātajvara,-
712,719,EC-3.8.19,eNIdAha-sAnnipAtajajvaraH,ēṇīdāha-sānnipātajajvaraḥ,एणीदाह-सान्निपातजज्वरः,-,-,-,ēṇīdāha- sannipātajvara,-
713,720,EC-3.8.20,hAridra-sannipAtajvaraH,hāridra-sannipātajvaraḥ,हारिद्र-सन्निपातज्वरः,-,-,-,hāridra- sannipātajvara,-
714,721,EC-3.8.21,ajaghoSha-sAnnipAtajajvaraH,ajaghōṣa-sānnipātajajvaraḥ,अजघोष-सान्निपातजज्वरः,-,-,-,ājaghōśa- sannipātajvara,-
715,722,EC-3.8.22,BUtahAsa-sAnnipAtajajvaraH,bhūtahāsa-sānnipātajajvaraḥ,भूतहास-सान्निपातजज्वरः,-,-,-,bhūtahāsa- sannipātajvara,-
716,723,EC-3.8.23,yantrapIDA-sAnnipAtajajvaraH,yantrapīḍā-sānnipātajajvaraḥ,यन्त्रपीडा-सान्निपातजज्वरः,-,-,-,yantraphidā- sannipātajvara,-
717,724,EC-3.8.24,saMSoShI-sannipAtajvaraH,saṁśōṣī-sannipātajvaraḥ,संशोषी-सन्निपातज्वरः,-,-,-,samsōṣī- sannipātajvara,-
718,725,EC-3.8.25,SItA~gga-sAnnipAtajajvaraH,śītāṅga-sānnipātajajvaraḥ,शीताङ्ग-सान्निपातजज्वरः,-,-,-,śītaṅga- sannipātajvara,-
719,726,EC-3.8.26,tandrika-sAnnipAtajajvaraH,tandrika-sānnipātajajvaraḥ,तन्द्रिक-सान्निपातजज्वरः,-,-,-,tantrika- sannipātajvara,-
720,727,EC-3.8.27,pralApaka-sAnnipAtajajvaraH,pralāpaka-sānnipātajajvaraḥ,प्रलापक-सान्निपातजज्वरः,-,-,-,pralāpaka- sannipātajvara,-
721,728,EC-3.8.28,raktaShThIvI-sAnnipAtajajvaraH,raktaṣṭhīvī-sānnipātajajvaraḥ,रक्तष्ठीवी-सान्निपातजज्वरः,-,-,-,raktaśtīvi- sannipātajvara,-
722,729,EC-3.8.29,aBinyAsa-sAnnipAtajajvaraH,abhinyāsa-sānnipātajajvaraḥ,अभिन्यास-सान्निपातजज्वरः,-,-,-,abhinyasa- sannipātajvara,-
723,730,EC-3.8.30,jihvaka-sAnnipAtajajvaraH,jihvaka-sānnipātajajvaraḥ,जिह्वक-सान्निपातजज्वरः,-,-,-,jihvaka- sannipātajvara,-
724,731,EC-3.8.31,sandhiga-sannipAtajvaraH,sandhiga-sannipātajvaraḥ,सन्धिग-सन्निपातज्वरः,-,-,-,sandhiga- sannipātajvara,-
725,732,EC-3.8.32,rugdAha-sAnnipAtajajvaraH,rugdāha-sānnipātajajvaraḥ,रुग्दाह-सान्निपातजज्वरः,-,-,-,rugdāha- sannipātajvara,-
726,733,EC-3.8.33,cittaviBrama-sAnnipAtajajvaraH,cittavibhrama-sānnipātajajvaraḥ,चित्तविभ्रम-सान्निपातजज्वरः,-,-,-,cittavibhrama- sannipātajvara,-
727,734,EC-3.8.34,karNika-sannipAtajvaraH,karṇika-sannipātajvaraḥ,कर्णिक-सन्निपातज्वरः,-,-,-,karṇika- sannipātajvara,-
728,735,EC-3.8.35,kaNThakubja-sannipAtajvaraH,kaṇṭhakubja-sannipātajvaraḥ,कण्ठकुब्ज-सन्निपातज्वरः,-,-,-,kaṇṭhakubja- sannipātajvara,-
729,736,EC-3.8.36,Bugnanetra-sAnnipAtajajvaraH,bhugnanētra-sānnipātajajvaraḥ,भुग्ननेत्र-सान्निपातजज्वरः,-,-,-,bhugnanētra- sannipātajvara,-
730,737,EC-3.8.37,kumBIpAka-sAnnipAtajajvaraH,kumbhīpāka-sānnipātajajvaraḥ,कुम्भीपाक-सान्निपातजज्वरः,-,-,-,kumbhīpāka- sannipātajvara,-
731,738,EC-3.8.38,asAdhya-sAnnipAtajvaraH,asādhya-sānnipātajvaraḥ,असाध्य-सान्निपातज्वरः,-,-,-,irremediable sannipātajvara,-
732,739,EC-3.8.39,hataujaH,hataujaḥ,हतौजः,-,"the disorder is characterized by gātrastambhaḥ [stiffness of body parts], śītagātratā [cold limbs], śayana īpsā [desire for sleeping], acaitanyam [unconciousness], tandrā (jāgrat svapan api) [lassitude (while awake and sleep too)], pralāpaḥ (jāgrat svapan api) [excess talking/irrelevant speech/incoherent speech (while awake and sleep too)], saṁhr̥ṣṭarōmaḥ [horripilation], srastāṅgatā [flaccidity/laxity], mandasantāpaḥ [mild burning], mandavēdanā [mild pain], sannipātajvarasya liṁgam [clinical features of sannipata jvara]",-,hatauja- sannipātajvara,-
733,740,EC-3.8.40,saMnyAsa-sannipAtajajvaraH,saṁnyāsa-sannipātajajvaraḥ,संन्यास-सन्निपातजज्वरः,-,-,-,sanyāsa- sannipātajvara,-
734,741,EC-3.8.41,samasannipAtajvaraH,samasannipātajvaraḥ,समसन्निपातज्वरः,-,-,-,sannipātajvara due to equally aggravated three dōśa,-
735,742,EC-3.8.42,viShamasannipAtajvaraH,viṣamasannipātajvaraḥ,विषमसन्निपातज्वरः,-,-,-,sannipātajvara due to disproportionately aggravated three dōṣa,-
736,743,EC-3.8.43,sannipAta-jvaropadravaH,sannipāta-jvarōpadravaḥ,सन्निपात-ज्वरोपद्रवः,-,-,-,complications of sannipAta jvara,-
