Sr No.,NAMC_ID,NAMC_CODE,NAMC_term,NAMC_term_diacritical,NAMC_term_DEVANAGARI,Short_definition,Long_definition,Ontology_branches,Name_English,Name_English_Under_Index
403,401,BE-1,asthikShayaH,(a) asthikṣayaḥ,अस्थिक्षयः,-,"It is characterized by scalp hair fall, thinning, body hair fall, thinning, nail fall, thinning, beard, moustache fall, thinning, teeth fall, decaying, exhaustion, fatigue, dislocation of joint, lax joints, pain in the bones, gums and tooth, cracked teeth, cracked nail, dryness, roughness, dryness, pricking type of pain in the bones, desire to eat bony-meat. (a) This may be explained by morbid decrease bone tissue.",-,Depletion of bone tissues pattern (TM2),-
404,402,BE-2,asthivRuddhiH,(a) asthivṛddhiḥ,अस्थिवृद्धिः,-,"It is characterized by excessive growth of bones, bone growing over another and excessive growth of teeth, redundant tooth which grows over another. (a) This may be explained by morbid increase bone tissue.",-,Increase of bone tissues pattern (TM2),-
405,403,BF,majjAvaiShamyam,,मज्जावैषम्यम्,-,-,-,majjā vitiation,-
406,404,BF-1,majjAkShayaH,(a) majjākṣayaḥ,मज्जाक्षयः,-,"It is characterized by decaying, weakness, lightness, repeatedly affliction with diseases due to vata, less quantity of semen , śukra, breaking type of pain in small joints, pricking, piercing type of pain of the bone, feeling of emptiness in bones, porousness of bones, giddiness or dizziness, black out. (a) This may be explained by morbid decrease in bone marrow tissue.",-,Depletion of bone marrow pattern (TM2),-
407,405,BF-2,majjAvRuddhiH,(a) majjāvṛddhiḥ,मज्जावृद्धिः,-,"It is characterized by heaviness of the whole body, heaviness and swelling of the eyes, redness of eyes, redness of body, furuncles at the base of small joints ,swollen phalanges, oliguria, and nonhealing ulcers. (a) This may be explained by morbid increase in bone marrow tissue.",-,Increase of bone marrow pattern (TM2),-
408,406,BG,SukravaiShamyam,,शुक्रवैषम्यम्,-,-,-,śukradhātu vitiation,-
409,407,BG-1,SukrakShayaH,(a) śukrakṣayaḥ,शुक्रक्षयः,-,"It is characterized by weakness or loss of physical strength, dryness of mouth, pallor, pale colour of body parts, exhaustion or tiredness to body and mind, exhaustion, fatigue, inability to perform sexual act, impotence, not able to ejaculate semen, suppression of semen, penile pain, scrotal pain, severe pain in scrotum, inability to perform sexual act, delayed ejaculation, semen with little blood on ejaculation, blackout, pricking type of pain in scrotum, smoky sensation in penis. (a) This may be explained by morbid decrease in reproductive tissue.",-,Depletion of reproductive tissues and semen pattern (TM2),-
410,408,BG-2,SukravRuddhiH/SukrAdhikyam,(a) śukravṛddhiḥ                     (a) śukrādhikyam,शुक्रवृद्धिः/शुक्राधिक्यम्,-,"It is characterized by seminal calculi, precipitated semen as calculus, excessive ejaculation of semen, excessive desire of intercourse with women. (a) This may be explained by morbid increase in reproductive tissue.",-,Increase of reproductive tissues and semen pattern (TM2),-
411,409,BA-3,ArtavavaiShamyam,,आर्तववैषम्यम्,-,-,-,ārtava disorder,-
412,410,BA-3.1,ArtavakShayaH,(a) ārtavakṣayaḥ,आर्तवक्षयः,-,"It is characterized by menstruation not on proper time, metrorrhagia, scanty menstrual flow, pain in vagina. This may be explained by decrease in circulating fluid in turn causing quantitative decrease of menstrual flow.",-,Diminution of menstrual flow pattern (TM2),-
413,411,BA-3.2,ArtavavRuddhiH,(a) ārtavavṛddhiḥ,आर्तववृद्धिः,-,"It is characterized by generalised bodyache, excessive menstrual bleeding, menorrhagia, bad odour. This may be explained by increase in circulating fluid in turn causing quantitative increase of menstrual flow.",-,Increased menstrual flow pattern (TM2),-
414,412,BA-4,stanyavaiShamyam,,स्तन्यवैषम्यम्,-,-,-,vitiation of stanya,-
415,413,BA-4.1,stanyakShayaH,(a) stanyakṣayaḥ,स्तन्यक्षयः,-,It is characterised by decreased or cessation of secretion of breast milk may be associated with decreased size of the breast. This may be explained by: (a) Aggravation of vatadosha and decreased primary product of digested food resulting in reduced breast milk production.,-,Decreased breastmilk disorder (TM2),-
416,414,BA-4.2,stanyavRuddhiH,(a) stanyavṛddhiḥ,स्तन्यवृद्धिः,-,"It is characterized by fully extended, large breast, frequent lactation, pricking pain. This may be explained by increase in circulating fluid in turn causing quantitative increase of breast milk.",-,Increased secretion of breast milk pattern (TM2),-
417,415,BH,ojovaiShamyam,(a) ojovaiṣamyam,ओजोवैषम्यम्,-,It is characterised by overall decrease of health leading to impaired immunity resulting in susceptibility to disease. This may be explained by: (a) Ojas gets vitiated by dosha and affecting the whole body.,-,Impaired immunity disorder (TM2),-
418,416,BH-1,ojakShayaH,(a) ojaḥkṣayaḥ,ओजक्षयः,-,"It is characterized by fear, loss of physical strength or weakness, constantly thinking, distressed sense organs, sense organs not able to perform properly, diminished complexion, lack mental strength, dry, wasted, dried up, emaciated, syncope, attacks of swooning, extreme wasting of muscles, diminution of muscle mass, confusion, delirium, excess talking, irrelevant speech, incoherent speech, death. This may be explained by morbid decrease (quantitative) of ojas and consequent physiological and pathological ramifications.",-,Diminution of Ojas pattern (TM2),-
419,417,BH-2,oja-visraMsaH,(a) ojovisraṃsaḥ,ओज-विस्रंसः,-,"It is characterized by loosening, dislocation of joints, exhaustion or tiredness of body, depletion of dosha, suppression of activities. This may be explained by unwarranted movement of ojas from intended normal location(s) resulting in morbidity.",-,Dislodgement of Ojas pattern (TM2),-
420,418,BH-3,oja-vyApat,(a) ojovyāpat,ओज-व्यापत्,-,"It is characterized by stiffness of the body, heaviness of limbs, swelling caused by vāta, discoloration of the skin; fatigued mind and body, drowsiness, lassitude, sleep. This may be explained by altered, detrimental changes (qualitative) of ojas resulting in consequent physiological and pathological ramifications.",-,Derangement of Ojas pattern (TM2),-
421,420,BI,rAjayakShmA,(a) rājayakṣmā,राजयक्ष्मा,-,"It is characterised by continuous low grade fever for a prolonged period of time along with dry skin, sunken cheeks and eyes, anorexia, gradual loss of strength. This may be explained by: (a) Vitiation of all three dosha (predominantly kapha) leading to obstruction of channels gradually depleting all the seven tissues.",-,Consumptive disorder (TM2),-
422,420,BI,rAjayakShmA,(a) rājayakṣmā,राजयक्ष्मा,-,"It is characterised by continuous low grade fever for a prolonged period of time along with dry skin, sunken cheeks and eyes, anorexia, gradual loss of strength. This may be explained by: (a) Vitiation of all three dosha (predominantly kapha) leading to obstruction of channels gradually depleting all the seven tissues.",-,Consumptive disorder (TM2),-
423,421,BI-1,rAjayakShmA-pUrvarUpam,,राजयक्ष्मा-पूर्वरूपम्,-,-,-,prodromes of rājayakṣma,-
424,422,BI-2,sAhasaja-rAjayakShmA,,साहसज-राजयक्ष्मा,-,-,Note: Also Classifed under #san@SoNitajanyarogaH#[ED-2],rājayakṣma due to physical exertion,-
425,423,CC-2,vegarodhaja-rAjayakShmA,(a) svedavṛddhiḥ,स्वेदवृद्धिः,-,It is characterised by excessive sweating. This may be explained by: (a) Increased pittadosha.,-,Excess of sweat disorder (TM2),-
426,424,BI-3,viShamASanaja-rAjayakShmA,vēgarōdhaja-rājayakṣmā,वेगरोधज-राजयक्ष्मा,-,"the disorder is characterized by pratiśyāyam [cold, catarrh], kāsaḥ [cough], svarabhēdam [hoarseness of voice], arōcakam [tastelessness], pārśvaśūlam [pain in sides of chest/flanks], śiraḥśūlam [headache], jvaraḥ [fever], aṁsāvamardanam [crushing type of pain in shoulders], aṅgamardaḥ [generalised bodyache], muhuśchardiḥ [frequent vomiting], varcōbhēdam [diarrhoea/loose motions], purīṣaśōṣaḥ [depletion of purisha/feces], kaṇṭhāvadhamanam [irritation in the throat], urō'vadhamanam [irritation in chest], śvāsam [breathlessness/difficult breathing]",-,rājayakṣma due to withholding natural urges,-
427,425,BI-4,kShayaja-rAjayakShmA,viṣamāśanaja-rājayakṣmā,विषमाशनज-राजयक्ष्मा,-,"the disorder is characterized by pratiśyāyam [cold, catarrh], prasēkam [exessive salivation], kāsaḥ [cough], chardim [vomiting], arōcakam [tastelessness], jvaram [fever], aṁsābhitāpam [burning sensation in shoulders/scapula], chardanaṁ rudhirasya [hemoptysis], pārśvaśūlam/pārśvasaṁrujam [pain in sides of chest/flanks], śiraḥśūlam [headache], svarabhēdam [hoarseness of voice], śūlam [colicky pain in the abdomen], aṅgamardaḥ [generalised bodyache], kaṇṭhōddhvaṁsanam [hoarseness of voice], aṁsāvamardam [crushing type of pain in shoulders], atīsāram [diarrhoea], antardāham [burning sensation inside the body], śirasō gurutvam [heaviness of the head], uraḥkṣatam [traumatic chest/pulmonary trauma], daurbalyam [weakness]",-,rājayakṣma due to unsalutary food,-
428,426,BI-5,vyavAyajanyarAjayakShmA,kṣayaja-rājayakṣmā,क्षयज-राजयक्ष्मा,-,"the disorder is characterized by sandhiśaithilyam [dislocation of joint/lax joints], raukṣyam [dryness], pratiśyāyam [cold, catarrh], jvaram [fever], kāsaḥ [cough], aṅgamardaḥ [generalised bodyache], śirōrujam [headache], śvāsam [breathlessness/difficult breathing], viḍbhēdam [altered stools/loose motions], arucim/arōcakam [tastelessness], pārśvaśūlam [pain in sides of chest/flanks], svarakṣayam [diminution of voice/loss of voice], aṁsasantāpam [burning sensation in shoulders/scapular region], daurbalyam [weakness], pariśōṣayati māṁsaśōṇitē [depletion /drying up of mamsa/rakta], aṁsāvamardam [crushing type of pain in shoulders], kaṇṭhōddhvaṁsanam [hoarseness of voice], avipākam [delayed digestion/indigestion], śvāsam [breathlessness/difficult breathing], svarabhēdam [hoarseness of voice], uraḥkṣatam [traumatic chest/pulmonary trauma], śōṇitaṁ ṣṭhīvati [hemoptysis]",-,rājayakṣma due to depletion of body elements,-
429,427,BI-6,SoShajanyarAjayakShmA,vyavāyajanyarājayakṣmā,व्यवायजन्यराजयक्ष्मा,-,"the disorder is characterized by pāṇḍudēhaḥ [pallor], śukrakṣayaliṅgāni [signs of depletion of śukra dhātu], yathāpūrvadhātukṣayaliṅgāni [depletion of earlier dhātu]",-,rājayakṣma due to excessive copulation,-
430,428,BI-7,SokajanyarAjayakShmA,śōṣajanyarājayakṣmā,शोषजन्यराजयक्ष्मा,-,-,-,rājayakṣma due to śōṣa,-
431,429,BI-8,vArdhakyajanyarAjayakShmA/jarASoShaH,śōkajanyarājayakṣmā,शोकजन्यराजयक्ष्मा,-,"the disorder is characterized by pradhyānaśīlaḥ [always in thoughtful mood], srastāṅgaḥ [flaccidity/laxity], pāṇḍudēhaḥ [pallor]",-,rājayakṣma due to excessive grief,-
432,430,BI-9,vyAyAmajanyarAjayakShmA,vārdhakyajanyarājayakṣmā/jarāśōṣaḥ,वार्धक्यजन्यराजयक्ष्मा/जराशोषः,-,"the disorder is characterized by kr̥śaḥ [emaciated/thin /malnourished], mandavīryaḥ [having little virility/energy], mandabuddhiḥ [mental dullness/stupid], mandabalam [reduced physical strength], indriyamandatā [decreased ability of sense organs], kampaḥ [tremors], aruciḥ/arucipīḍitaḥ [tastelessness/afflicted with tastelessness], bhinnakāṁsyapātrahatasvaraḥ [voice resembles the sound produced by a crackled bell metal pot], ślēṣmaṇā hīnaṁ ṣṭhīvati [spits minimal phlegm], gauravapīḍitaḥ [afflicted with heaviness], saṁprasrutāsyam [watery discarge from the mouth], saṁprasrutanāsā [watery discarge from the nose], saṁprasrutākṣiḥ [watery discharge from eyes], suptarūkṣachaviḥ/śuṣkarūkṣachaviḥ [dull appearance], rūkṣamalaḥ/śuṣkarūkṣamalaḥ [passes dry faeces], aratipīḍitaḥ [severe distress/dicontent/restlessness]",-,senile rājayakṣma,-
433,431,BI-10,adhvajanya-rAjayakShmA/SoSha,vyāyāmajanyarājayakṣmā,व्यायामजन्यराजयक्ष्मा,-,"the disorder is characterized by urōruk [pain in the chest], śōṇitacchardiḥ [haematemesis], vaiśēṣikaḥ kāsaḥ [typical type of or excessive cough], saraktamūtratvam [haematuria], pārśvagrahaḥ [stiffness in sides of chest], pr̥ṣṭhagrahaḥ [stiffness of back], kaṭigrahaḥ [stiffness of the lumbar region/lowback], uraḥkṣataliṅgāni (kṣatādvinā) [clinical features of traumatic chest/pulmonary trauma (consumption) without injury]",-,rājayakṣma due to over exercise,-
434,432,BI-11,vraNajanyarAjayakShmA,adhvajanya-rājayakṣmā/śōṣa,अध्वजन्य-राजयक्ष्मा/शोष,-,"the disorder is characterized by srastāṅgaḥ [flaccidity/laxity], saṁbhr̥ṣṭaparuṣacchaviḥ [fading colour], prasuptagātrāvayavaḥ [numbness of limbs], śuṣkaklōmagalānanaḥ [dryness of klōma, throat, face]",-,rājayakṣma due to excessive walking,-
435,433,BI-12,uraHkShatajanyarAjayakShmA,vraṇajanyarājayakṣmā,व्रणजन्यराजयक्ष्मा,-,"the disorder is characterized by raktakṣayaḥ [diminution of rakta], vēdanā [pain]",-,rājayakṣma due to wounds,-
436,434,BI-13,vAtikarAjayakShmA,uraḥkṣatajanyarājayakṣmā,उरःक्षतजन्यराजयक्ष्मा,-,"the disorder is characterized by urasi kṣatē raktaṁ gacchati [blood discharge from traumatic chest/pulmonary trauma], urasi kṣatē pūyaḥ gacchati [pus discharge from traumatic chest /pulmonary trauma], urasi kṣatē ślēṣmā gacchati [mucus discharge from traumatic chest/pulmonary trauma], kāsamānaśchardayēt pītam [yellowish expectoration while coughing], kāsamānaśchardayēt raktam [expectoration of blood while coughing], kāsamānaśchardayēt asitam [blackish expectorant while coughing], kāsamānaśchardayēt aruṇam [reddish brown coloured expectorant while coughing], santaptavakṣāḥ [chest is felt to be warm/hot], atyarthaṁ dūyanātparitāmyati [faints due to exessive pain], durgandhavadanaḥ [foul odour from mouth/hallitosis], durgandhōcchvāsaḥ [foul odour emitted from breath], bhinnavarṇaḥ [altered colour/complexion of body], bhinnasvaraḥ [hoarseness of voice]",-,rājayakṣma due to traumatic chest,-
437,435,BI-14,paittikarAjayakShmA,vātikarājayakṣmā,वातिकराजयक्ष्मा,-,"the disorder is characterized by svarabhēdaḥ [hoarseness of voice/any defect in speaking], aṁsayōḥ śūlam [pain in shoulders], pārśvayōḥ śūlam [pain in sides of chest/flanks], aṁsayōḥ saṁkōcaḥ/saṁlōcaḥ [contraction of shoulders], pārśvayōḥ saṁkōcaḥ/saṁlōcaḥ [contraction of flanks], śiraḥśūlam [headache], aṁsamardanam [crushing type of pain in shoulders], aṅgamardaḥ [generalised bodyache], kaṇṭhōddhvaṁśaḥ [hoarseness of voice], svarabhraṁśaḥ [altered voice]",-,rājayakṣma due to vāta,-
438,436,BI-15,kaPajarAjayakShmA,paittikarājayakṣmā,पैत्तिकराजयक्ष्मा,-,"the disorder is characterized by jvaraḥ [fever], dāhaḥ [burning sensation], raktasya āgamaḥ/asr̥kcchardiḥ [haemoptysis], atisāraḥ [diarrhoea], pādadāhaḥ [burning in feet], aṁsadāhaḥ [burning in shoulders], pāṇidāhaḥ [burning in palms], mukhagandhaḥ [bad smell of the mouth], madaḥ [intoxication]",-,rājayakṣma due to pitta,-
439,437,BI-16,yakShmajajvaraH,kaphajarājayakṣmā,कफजराजयक्ष्मा,-,"the disorder is characterized by chardiḥ [vomiting], mūrdhagauravam [heaviness of head], aṅgagauravam [heaviness in the body], prasēkaḥ [excessive salivation], pīnasaḥ [cold, catarrh], śvāsaḥ [breathlessness/difficult breathing], svarasādaḥ [loss of voice], alpavahnitā [diminution of agni/reduced digestive power]",-,rājayakṣma due to kapha,-
440,438,BI-17,yakShmajaSiraHSUlaH,yakṣmajajvaraḥ,यक्ष्मजज्वरः,-,-,-,unmāda due to possession of yakSha,-
441,439,BI-18,asAdhya-rAjayakShmA/asAdhyaSoSha,yakṣmajaśiraḥśūlaḥ,यक्ष्मजशिरःशूलः,-,-,-,headache due to rājayakṣma,-
442,440,BI-19,cikitsya-rAjayakShmA,asādhya-rājayakṣmā/asādhyaśōṣa,असाध्य-राजयक्ष्मा/असाध्यशोष,-,"the disorder is characterized by mahāśanam [eats more quantity food], kṣīyamāṇam [debilitated], atisāranipīḍitam [afflicted with diarrhoea], śūnamuṣkam [swelling of scrotum], śūnōdaram [enlargement/swelling of abdomen], śuklākṣam [whitish discolouration of eyes], annadvēṣṭāram [person having aversion towards food], ūrdhvaśvāsanipīḍitam [afflicted with shortness of breathing], kr̥cchrēṇa bahumēhantam [polyuria with dysuria]",-,irremediable rājayakṣma,-
443,441,BI-20,rAjayakShmA-upadravaH,cikitsya-rājayakṣmā,चिकित्स्य-राजयक्ष्मा,-,"the disorder is characterized by jvarānubandharahitam [not associated with fever], balavantam [having physical strength], kriyāsaham [able to do activities/ableto sustain treatment procedures], ātmavantam [self control], dīptāgnim [having agni well kindled i.e. digesting well], akr̥śam [not emaciated]",-,curable rājayakṣma,-
444,442,BI-21,yakShmA-ariShTaH,rājayakṣmā-upadravaḥ,राजयक्ष्मा-उपद्रवः,-,"the disorder is characterized by kaṇṭhōddhvaṁsaḥ [hoarseness of voice], urōrujam [pain in the chest], jr̥mbhā [yawning], aṅgamardaḥ [generalised bodyache], niṣṭhīvaḥ [expectoration of sputum/spitting], vahnisādaḥ [diminution of agni], āsyapūtitā [putridness of mouth]",-,complications of rājayakṣma,-
445,443,BI-22,atikArSyam,yakṣmā-ariṣṭaḥ,यक्ष्मा-अरिष्टः,-,"the disorder is characterized by aṁsābhitāpaḥ/aṁsatāpaḥ [burning sensation in shoulders/scapula], hikkā [hiccup], śōṇitacchardiḥ/raktacchardiḥ [vomiting of blood], ānāhaḥ [barborygmus with distention], pārśvarujā/pārśvaśūlam [pain in sides of chest/flanks]",-,fatal signs of rājayakṣma,-
446,444,BJ,malavaiShamyam,atikārśyam,अतिकार्श्यम्,-,-,-,emaciation in excess,-
447,445,C,mUtravaiShamyam,malavaiṣamyam,मलवैषम्यम्,-,-,-,derangement of excretory products,-
448,446,CA,mUtrakShayaH,mūtravaiṣamyam,मूत्रवैषम्यम्,-,-,-,mūtra vitiation,-
449,447,CA-1,mUtravRuddhiH,mūtrakṣayaḥ,मूत्रक्षयः,-,"It is characterized by dysuria, pricking pain in urinary bladder, oliguria, discolouration of urine, hematuria, thirst and dryness of mouth. This may be explained by abnormal decrease in urine production resulting in local and systemic manifestations.",-,Reduced urine pattern (TM2),-
450,447,CA-1,mUtravRuddhiH,mūtrakṣayaḥ,मूत्रक्षयः,-,"It is characterized by dysuria, pricking pain in urinary bladder, oliguria, discolouration of urine, hematuria, thirst and dryness of mouth. This may be explained by abnormal decrease in urine production resulting in local and systemic manifestations.",-,Reduced urine pattern (TM2),-
451,448,CA-2,purIShavaiShamyam,(a) mūtravṛddhiḥ,मूत्रवृद्धिः,-,"It is characterized by frequent micturition, pricking pain in urinary bladder, abdominal distension, feeling of urge even after micturition. This may be explained by abnormal increase in urine production resulting in local and systemic manifestations.",-,Excessive urine pattern (TM2),-
452,449,CB,purIShakShayaH,,पुरीषवैषम्यम्,-,-,-,abnormal stool,-
453,450,CB-1,purIShavRuddhiH,(a) purīṣakṣayaḥ,पुरीषक्षयः,-,"It is characterized by gripping type of pain (colic), pain in the pericardial region, angina pectoris, pain in flanks, reverse intestinal movement of vāta associated with sound, oblique movement of vāta with sound in abdomen, increased bowel movements in flanks, less quantity of faeces. This may be explained by abnormal decrease in fecal production resulting in local and systemic manifestations.",-,Depletion of faeces pattern (TM2),-
454,451,CB-2,sAmamalaH,(a) purīṣavṛddhiḥ,पुरीषवृद्धिः,-,"It is characterized by gurgling sound in flanks, heaviness and enlargement of abdomen. Gurgling sound in flanks to be changed to gurgling sounds in abdomen. This may be explained by abnormal accumulation of feces resulting in local and systemic manifestations.",-,Morbid increase of feces pattern (TM2),-
455,452,CB-3,svedavaiShamyam,(a) sāmamalaḥ,साममलः,-,"It is characterized by obstruction in channels, diminution of physical strength, heaviness, lethargy, indigestion, spitting out, obstruction to passage of faeces, tastelessness and exhaustion without exertion. This may be explained by consequences incompletely formed stools due to diminished digestive fire.",-,Faeces with undigested food residues pattern (TM2),-
456,453,CC,svedakShayaH,,स्वेदवैषम्यम्,-,-,-,disorders of perspiration,-
457,454,CC-1,svedavRuddhiH,(a) svedakṣayaḥ,स्वेदक्षयः,-,"It is characterized by stiff, rigid body hairs, wasting, contracture of skin, impaired touch perception, loss of perspiration, hair fall, tearing, cracking of skin, numbness of skin, hardness, roughness of skin. This may be explained by abnormal decrease in sweat production resulting in local and systemic manifestations.",-,Anhidrosis pattern (TM2),-
458,455,CZ-1,jihvAmUlagatamalaH,,जिह्वामूलगतमलः,-,-,-,coat at the root of the tongue,-
459,457,D,agnivaiShamyam,(a) agnivaiṣamyam,अग्निवैषम्यम्,-,It is characterized by derangement of digestive power. This may be explained by vitiation of digestive fire in turn resulting in local and systemic effects.,-,Derangement of digestive power pattern (TM2),-
460,458,DA,AmadoShaH,(a) āmadoṣaḥ                         (a) āmavasthā,आमदोषः,-,"It is characterized by reduced body strength, heaviness of the body, reduced digestive power, lethargy, indigestion, expectoration, tastelessness, feeling of weakness even without exertion. This may be explained by vitiation of digestive fire in turn resulting incomplete digestion or metabolism resulting in a suspended state of physiological processes and consequent pathologies.",-,"State of incomplete digestion, transformation or metabolism pattern (TM2)",-
461,461,DA-1,asAdhya-AmadoShaH,,असाध्य-आमदोषः,-,-,-,irremediable vitiated-āma,-
462,462,DB,jaTharAgnivikAraH,,जठराग्निविकारः,-,-,-,disorders of digestive power,-
463,463,DB-1,mandAgniH/ agnisAda,,मन्दाग्निः/ अग्निसाद,-,-,Note: Also Classifed under #san@SoNitajanyarogaH#[ED-2],subdued digestive power,-
464,464,DB-1.1,mandAgni-ariShTaH,"(a) mandāgniḥ,                          (a) agnisādaḥ",मन्दाग्नि-अरिष्टः,-,It is characterized by delayed digestion of food. This may be explained by vitiation of digestive fire in turn resulting delaying digestion and metabolism.,-,Subdued digestive power pattern (TM2),-
465,465,DB-2,viShamAgniH,(a) viṣamāgniḥ,विषमाग्निः,-,It is characterized by irregular digestion irrespective of quantity and quality of food. This may be explained by vitiation of digestive fire in turn resulting in erratic behavour of digestive system.,-,Irregular digestive power pattern (TM2),-
466,466,DB-3,tIkShNAgniH,(a) tīkṣṇāgniḥ,तीक्ष्णाग्निः,-,It is characterized by quick digestion of varied quantity and quality of food. This may be explained by vitiation of digestive fire in turn resulting quickening digestion and metabolism.,-,Elevated digestive power pattern (TM2),-
467,467,DB-4,atyagniH/BasmakaH,"(a) atyagniḥ,                            (a) bhasmakaḥ",अत्यग्निः/भस्मकः,-,"It is characterized by severly increased state of digestive power leading to quick digestion of food despite of frequent and extra quantity intake. If food is not taken, leads to digestion of body tissues leading to weakness, succumbs to death, may be associated with thirst, difficulty in breathing, burning sensation, syncope, burning sensation in throat, palate, lips at the end of digestion. This may be explained by morbid increase of the digestive fire resulting accelerated metabolism to the extent that the tissues are also get affected.",-,Highly elevated digestive power pattern (TM2),-
468,468,SR5Zâ‚¬,srotovaiShamyam,(a) srotovaiṣamyam,स्रोतोवैषम्यम्,-,-,-,"Derangement of channels pattern (TM2), unspecified",-
469,469,EA,prANavahasrotovikAraH,,प्राणवहस्रोतोविकारः,-,-,-,disorders of prāṇavahasrōtas,-
