Sr No.,NAMC_ID,NAMC_CODE,NAMC_term,NAMC_term_diacritical,NAMC_term_DEVANAGARI,Short_definition,Long_definition,Ontology_branches,Name_English,Name_English_Under_Index
978,1007,ED-10.10,kardamavisarpaH/pittakaPajavisarpaH,kardamavisarpaḥ/pittakaphajavisarpaḥ,कर्दमविसर्पः/पित्तकफजविसर्पः,-,"the disorder is characterized by śītajvaraḥ [fever with chills], śirōgurutvam [heavyness of head], dāhaḥ [burning sensation], staimityam [a sensation of being covered with wet clothes], aṅgāvasādaḥ [fatigue], nidrā [sleep], tandrā [drowsiness/lassitude], mōhaḥ [confusion/delirium], annadvēṣaḥ [aversion to food], pralāpaḥ [excess talking/irrelevant speech/incoherent speech], agnināśaḥ/agnihāniḥ [loss of agni (digestive power)], daurbalyam [weakness], asthi-bhēdaḥ [breaking/splitting type of pain in the bones], mūrcchā [syncope/attacks of swooning], pipāsā [thirst], srōtasāṁ pralēpaḥ [feeling of wrapped of srōtasa], jāḍyam indriyāṇām [dullness/inactiveness/sluggishness of sense organs], prāyōpavēśanam [defecation of stools with āma], aṁgavikṣēpaṇam [convulsive movements of body], aṁgamardaḥ [generalized bodyache], aratiḥ [distress/dicontent/restlessness], autsukyam [anxious curiosity], prāyaḥ āmāśayē visarpati alasakaḥ [predominantly in āmāśaya region], ēkadēśagrāhī [affecting specific organ/region/body part], raktapiḍakāvakīrṇāvakāśaḥ/lōhita [area comprised of red nodules], pītapiḍakāvakīrṇāvakāśaḥ/atipītaḥ [area comprised of yellowish nodules], pāṇḍupiḍakāvakīrṇāvakāśaḥ/pāṇḍuraḥ [area comprised of whitiish nodules], mēcakābhapiḍakāvakīrṇāvakāśaḥ [area comprised of mēcaka (as like eyes of peacocks tail or collyrium) nodules], kālapiḍakāvakīrṇāvakāśaḥ [area comprised of blackish nodules], malināvakāśaḥ [misty /unclean area], snigdhāvakāśaḥ [unctuous area], bahūṣmāvakāśaḥ [area with excessive heat], guru [heaviness], stimitavēdanā [heavy and wet feeling with pain], śvayathumān [oedematous], gambhīrapākaḥ [deep seated suppuration], nirāsrāvaḥ [without any discharge], śīghraklēdaḥ [getting moist very quickly], svinnamāṁsam [soft tissue and muscles with sweat], klinnamāṁsam [soft tissue and muscles with moisture], svinnatvak [skin with sweat], klinnatvak [moist skin], pūtimāṁsa [putrifaction of māṁsa], pūti tvak [putrid smell], kramēṇālparuka [gradual mild pain], parāmr̥ṣṭō avadīryatē kardama iva [breaks down on touch and feel like muddy, slushy], avapīḍitō antaraṁ prayacchati [falls down after suppuration], upaklinnapūtimāṁsatyāgī (avapīḍitē) [(on pressure) foul smelling n moist soft tissue], sirāsnāyusaṁdarśī [blood vessels and soft tissue/muscles are visible], kūṇapagandhiḥ [cadaveric smell], saṁjāhāniḥ [loss of conciousness], smr̥tihāniḥ [dementia], stambhaḥ [rigidity/stiffness], arōcakaḥ [tastelessness], bhramaḥ [giddiness or dizziness], indriyagauravam [dulling of senses], āmōpavēśanaḥ [defecation of stools with āma], gambhīrapākaḥ [deep seated suppuration], spr̥ṣṭaḥ klinnōऽvadīryatē| [friable to touch as it is sodden], paṅkavacchīrṇamāṁsaḥ [appears like mud due to muscles being decayed], spaṣṭasnāyu-sirāgaṇaḥ [exposed ligamentstendons and the vascular bundles], śavagandhaḥ [cadaveric smell]",-,visarpa due to pitta and kapha,-
979,1008,ED-10.11,sAnnipAtajavisarpaH,sānnipātajavisarpaḥ,सान्निपातजविसर्पः,-,-,-,visarpa due to three dōṣa,-
980,1009,ED-10.12,kShatajavisarpaH,kṣatajavisarpaḥ,क्षतजविसर्पः,-,"the disorder is characterized by śyāvaśōpham [grey colored oedema], lōhitaśōpham [red colored oedema], jvaraḥ [fever], dāhaḥ [burning sensation], pākam [inflammation/suppuration], kulatthasadr̥śaḥ sphōṭaḥ [kulattha seed like vescicles], asitasphōṭaḥ [blackish eruptions], rujā [pain]",-,visarpa due to trauma,-
981,1010,ED-10.13,asAdhya-visarpaH,asādhya-visarpaḥ,असाध्य-विसर्पः,-,"the disorder is characterized by marmāgatam [that which affects marma], śīrṇamāṁsam [withering of māṁsa], śīrṇasnāyu [withering of sinews], śīrṇasirā [withering of veins], praklinnaḥ [weeping], śavagandhaḥ [cadaveric smell]",-,incurable visarpa,-
982,1011,ED-10.14,visarpa-upadravaH,visarpa-upadravaḥ,विसर्प-उपद्रवः,-,"the disorder is characterized by jvaraḥ [fever], atisāraḥ [diarrhoea], vamathu [vomiting], tvak daraṇaṁ [breaking and withering of skin], māṁsa daraṇaṁ [breaking and withering of muscle-tissue], klamaḥ [exhaustion without exertion], arōcakaḥ [tastelessness], avipākaḥ [indigestion]",-,complications of visarpa,-
983,1012,ED-10.15,visarpa-ariShTaH,visarpa-ariṣṭaḥ,विसर्प-अरिष्टः,-,-,-,fatal signs of visarpa,-
984,1013,ED-11,Pira~ggaH,(a) phiraṅgaroga,फिरङ्गः,-,"It is characterised by painless, hard ulcers on the genetalia may be associated with discharge. This may be explained by: (a) Involvement of the three dosha and tissues such as blood, muscle and bone, which causes ulcer.",-,Syphillis disorder (TM2),-
985,1014,ED-11.1,bAhyaPira~ggaH,bāhyaphiraṅgaḥ,बाह्यफिरङ्गः,-,"the disorder is characterized by visphōṭasadr̥śaḥ [lesions or eruotions appear on the penis], alparuk [mild pain], sphuṭitō vraṇavat vēdyaḥ [pain as wound]",-,external-phiraṅga-rōga,-
986,1015,ED-11.2,aByantaraPira~ggaH,abhyantaraphiraṅgaḥ,अभ्यन्तरफिरङ्गः,-,"the disorder is characterized by sandhiṣu āmavāta iva vyathām [associated with joint pains like rheumatism], śōthaḥ [oedema], kaṣṭasādhyaḥ [difficult to cure]",-,Internal-phiraṅga-rōga,-
987,1016,ED-11.3,bahirAntara-Pira~ggaH,bahirāntara-phiraṅgaḥ,बहिरान्तर-फिरङ्गः,-,-,-,intro-external phiraṅga-rōga,-
988,1017,ED-12,plIharogaH,(a) plīhavruddhi                     (a) plīharogaḥ,प्लीहरोगः,-,It is characterised by enlargement of spleen. This may be explained by: (a) Dislodgement of spleen from its site due to over-exertion and related causes or enlargement of spleen due to aggravation of blood.,Note: Also Classifed under #san@udakavahasrotovikAraH#[EK],Splenomegaly disorder (TM2),-
989,1018,ED-12.1,vAtajaplIharogaH,vātajaplīharōgaḥ,वातजप्लीहरोगः,-,"the disorder is characterized by nityaṁ ānadhdakōṣṭhaḥ [continuous flatulence], nityaṁ udāvartapīḍitaḥ [reversed peristalsis], vēdanā [pain]",Note: Also Classifed under #san@udakavahasrotovikAraH#[EK],plīharōga due to vāta,-
990,1019,ED-12.2,pittajaplIharogaH,pittajaplīharōgaḥ,पित्तजप्लीहरोगः,-,"the disorder is characterized by sajvaraḥ [associated with fever], sapipāsā [thirst], sadāhaḥ [associated with burning sensation], mōhaḥ [semiconsciousness or stupefaction], pītagātraḥ [yellowishness]",Note: Also Classifed under #san@udakavahasrotovikAraH#[EK],plīharōga due to pitta,-
991,1020,ED-12.3,kaPajaplIharogaH,kaphajaplīharōgaḥ,कफजप्लीहरोगः,-,"the disorder is characterized by mandavyathā [mild pain], sthūlaḥ [broad, hard], kaṭhinaḥ (udaraḥ) [tenseness], gauravam (udarasya) [heaviness of body], arōcakaḥ [tastelessness]",Note: Also Classifed under #san@udakavahasrotovikAraH#[EK],plīharōga due to kapha,-
992,1021,ED-12.4,sannipAtaja-plIhodaraH,sannipātaja-plīhōdaraḥ,सन्निपातज-प्लीहोदरः,-,-,Note: Also Classifed under #san@udakavahasrotovikAraH#[EK],plīhōdara due to three dōṣa,-
993,1022,ED-12.5,raktajaplIharogaH/raktaja-plIhodaraH,raktajaplīharōgaḥ/raktaja-plīhōdaraḥ,रक्तजप्लीहरोगः/रक्तज-प्लीहोदरः,-,"the disorder is characterized by klamaḥ [exhaustion without exertion], bhramaḥ [giddiness or dizziness], vidāhaḥ [internal burning sensation], vaivarṇyam [discolouration], gātragauravam [heaviness of body parts], mōhaḥ [semiconsciousness or stupefaction], raktōdaratvam [reddening of the abdomen]",Note: Also Classifed under #san@udakavahasrotovikAraH#[EK],plīharōga due to rakta,-
994,1023,ED-12.6,asAdhya-plIhodaraH,asādhya-plīhōdaraḥ,असाध्य-प्लीहोदरः,-,-,Note: Also Classifed under #san@udakavahasrotovikAraH#[EK],incurable plīhōdara,-
995,1024,ED-13,SlIpadaH,(a) ślīpadaḥ,श्लीपदः,-,"It is characterised by a disorder characterised by non-pitting swelling of legs, unilateral or bilateral, swollen glands in groin, may be associated with fever. This may be explained by: (a) Vitiation of flesh, kapha and blood.",-,Elephantiasis disorder (TM2),Filariasis (TM2)
996,1025,ED-13.1,vAtajaSlIpadaH,vātajaślīpadaḥ,वातजश्लीपदः,-,"the disorder is characterized by kharaśōphaḥ [swelling rough on touch], kr̥ṣṇaśōphaḥ [black coloured swelling], paruṣaśōphaḥ [rough oedema], bahuśaḥ parisphuṭati [excessive cracks], rūkṣaḥ [rough swelling], tīvravēdanayutaḥ [severe pain], animittarujaḥ [pain appears without cause], bahuśa-jvaraḥ [frequent attacks of fever], paripōṭayutam [peeling of skin]",-,ślīpada due to vāta,-
997,1026,ED-13.2,pittajaSlIpadaH,pittajaślīpadaḥ,पित्तजश्लीपदः,-,"the disorder is characterized by pītāvabhāsaśōphaḥ/ pītasaṁkāśaśōphaḥ [yellowish coloured swelling], īṣata mr̥du śōphaḥ/ mr̥duśōphaḥ [soft swelling], jvaraḥ [fever], dāhaḥ [burning sensation]",-,ślīpada due to pitta,-
998,1027,ED-13.3,kaPajaSlIpadaH,kaphajaślīpadaḥ,कफजश्लीपदः,-,"the disorder is characterized by śvētaśōphaḥ [whitish coloured swelling], snigdhāvabhāsaśōphaḥ/snigdhaḥ/snigdhavarṇaḥ [glossy swelling], mandavēdanā/ aruk [mild pain], bhārikama [heavy in nature], mahāgranthikam [huge swelling], kaṇṭakairupacitam [associated with thorn like projections], guruśōphaḥ [heavy swelling in the inguinal region and in the foot], māṁsāṁkuraiścitam [associated with muscular growths], pāṇḍuśōphaḥ [pale swelling in the inguinal region and in the foot], guruśōphaḥ [heavy swelling], sthiraśōphaḥ [hard swelling in the inguinal region and in the foot]",-,ślīpada due to kapha,-
999,1028,ED-13.4,asAdhya-SlIpadaH,asādhya-ślīpadaḥ,असाध्य-श्लीपदः,-,"the disorder is characterized by saṁvatsarātītam [chronicity of more than one year], ati mahat [excessively large], vatmīkavat śōphaḥ [swelling resembling anthill], suparisrutiḥ [exudative swelling], kaṇṭakairupacitam [associated with thorn like projections]",-,incurable ślīpada,-
1000,1029,ED-14,SItapittam,śītapittam,शीतपित्तम्,-,"the disorder is characterized by varaṭīdaṣṭasaṁsthāna śōthaḥ [like that of sting of insect/wasp], kaṇḍūḥ [itching], tōdabahulaḥ [severe pricking type of pain], chardiḥ [vomiting], jvaraḥ [fever], vidāhaḥ [internal burning sensation], bahiḥ śōthaḥ [edematous lesions appear on the skin], vātādhikam [dominance of vātadōṣaḥ]",-,urticaria,-
1001,1030,ED-14.1,SItapitta-pUrvarUpam,śītapitta-pūrvarūpam,शीतपित्त-पूर्वरूपम्,-,"the disorder is characterized by pipāsā [thirst], aruciḥ [tastelessness], hr̥llāsaḥ [nausea], dēhasādaḥ [tiredness of the body], aṅgagauravam [heaviness in the body], raktalōcanatā [redness in the eyes]",-,prodromes of shItapitta,-
1002,1031,ED-15,udardaH,udardaḥ,उदर्दः,-,"the disorder is characterized by varaṭīdaṣṭasaṁsthāna śōthaḥ [like that of sting of insect/wasp], kaṇḍūḥ [itching], tōdabahulaḥ [severe pricking type of pain], chardiḥ [vomiting], jvaraḥ [fever], vidāhaḥ [internal burning sensation], bahiḥ śōthaḥ [edematous lesions appear on the skin], kaphādhikaḥ [dominance of kaphadōṣaḥ], utsaṁgaḥ [elevated lesions], rāgaḥ [redness/congestion], kaṇḍūḥ [itching], maṇḍalam [circular patches], vidāhaḥ [internal burning sensation]",-,urticaria,-
1003,1033,ED-16,BagandaraH,(a) bhagandaraḥ,भगन्दरः,-,"It is characterised by opening in the skin near the anus having communication with the rectum due to deep and severe ulcers of rectum, may be associated with pain, passing of fecal matter and gases through the track. This may be explained by: (a) Injury, deranged digestive and metabolic factors leading to vitiation of skin, blood, muscle, fat tissue.",-,Fistula in ano disorder (TM2),-
1004,1034,ED-16.1,Bagandara-pUrvarUpam,bhagandara-pūrvarūpam,भगन्दर-पूर्वरूपम्,-,"the disorder is characterized by kaṭīkapālavēdanā [pain at iliac region/iliac bones], kaṇḍūḥ [itching], dāhaḥ [burning sensation], gudaśōphaḥ [anal oedema], bhagandarapiḍikā [nodule leading to fistula-in-ano], dāhaḥ [burning sensation], rujā [pain]",-,prodromes of bhagandara,-
1005,1035,ED-16.2,SataponakaBagandaraH/vAtaja-BagandaraH,śatapōnakabhagandaraḥ/vātaja-bhagandaraḥ,शतपोनकभगन्दरः/वातज-भगन्दरः,-,"the disorder is characterized by aruṇavarṇapiḍakā [appearance of slightly red colored eruptions], tōdaḥ [pricking pain], śatapōnakavadaṇumukhaiśchidrairāpūryatē [full of multiple minute pores like that of sieve], apratikriyamāṇā ca pākamupaiti [if it remains untreated suppuration results], mūtrāśayābhyāsagatatvācca vraṇaḥ praklinnaḥ [due to close proximity to the urinary bladder the wound is always moist in nature], chidrāt ajasraṁ srāvaḥ [heavy discharge through opening], chidrāt acchaṁ srāvaḥ [clear discharge through opening], chidrāt phēnānuviddhasrāvaḥ [frothy discharge through opening], chidrāt adhikaṁ srāvaḥ [excessive discharge through opening], vraṇaḥ tāḍyatē [whipping pain], vraṇaḥ bhidyatē [tearing pain], vraṇaḥ chidyatē [biting pain], vraṇaḥ sūcībhiriva nistudyatē [pricking pain], gudaṁ avadīryatē [splitting sensation in anus], upēkṣitē chidraiḥ vātamutrapurīṣarētasāṁ āgamaḥ [if neglected flatulence, urine, faeces and semen starts oozing out of those openings], aṇumukhachidram [minute opening]",-,bhagandara having multiple openings/bhagandara due to vāta,-
1006,1036,ED-16.3,uShTragrIva-BagandaraH/pittaja-BagandaraH,uṣṭragrīva-bhagandaraḥ/pittaja-bhagandaraḥ,उष्ट्रग्रीव-भगन्दरः/पित्तज-भगन्दरः,-,"the disorder is characterized by raktavarṇapiḍakā [red colored nodule], tanvī piḍakā [smal nodule], ucchritapiḍakā [elevated noduel], cōṣaḥ [sucking type of pain], vraṇaḥ agni iva dahyatē [excessive burning in wound (like that of fire)], vraṇaḥ kṣāra iva dahyatē [burning sensation as chemical cautery], durgandham [foul smell], uṣṇaṁ āsrāvaḥ/ahimavāhinī [dischrge which is not cold], upēkṣitē chidraiḥ vātamutrapurīṣarētasāṁ āgamaḥ [if neglected flatulence, urine, faeces and semen starts oozing out of those openings], rakta-piḍakā (gudāśritām) [red eruptions in the anal region], āśupākaḥ [undergoes quick suppuration], pūtivāhinī [warm and foul smell discharge]",-,bhagandara due to pitta,-
1007,1037,ED-16.4,parisrAvI-BagandaraH/SleShmaja-BagandaraH,parisrāvī-bhagandaraḥ/ślēṣmaja-bhagandaraḥ,परिस्रावी-भगन्दरः/श्लेष्मज-भगन्दरः,-,"the disorder is characterized by śuklāvabhāsī piḍakā/ śvētāvabhāsaḥ [white coloured], sthirapiḍakā [immovable nodule (with large/fix base)], kaṇḍūmatī piḍakā [nodule with itching], kaṇḍūḥ [itching sensation], apratikriyamāṇā ca pākamupaiti [if it remains untreated suppuration results], kaṭhinavraṇaḥ [indurated], saṁrambhī [redness/congesion/inflammation], kaṇḍūprāyaḥ [associated with itching sensation], picchilasrāvaḥ/bahupicchā [slimy discharge], ajasraṁ srāvaḥ [continuos discharge], upēkṣitē chidraiḥ vātamutrapurīṣarētasāṁ āgamaḥ [if neglected flatulence, urine, faeces and semen starts oozing out of those openings], ghanasrāvaḥ [thick/dense discharge], mandavēdanā [mild pain]",-,bhagandara due to kapha,-
1008,1038,ED-16.5,parikShepi-BagandaraH/vAtapaittika-BagandaraH,parikṣēpi-bhagandaraḥ/vātapaittika-bhagandaraḥ,परिक्षेपि-भगन्दरः/वातपैत्तिक-भगन्दरः,-,"the disorder is characterized by parikṣipya gudaṁ gatiḥ [circular fistula around the anus], prākāraḥ parikhēva jāyatē [like that of pit around the fort]",-,bhagandara due to vāta and pitta,-
1009,1039,ED-16.6,Ruju-BagandaraH/vAtakaPaja-BagandaraH,r̥ju-bhagandaraḥ/vātakaphaja-bhagandaraḥ,ऋजु-भगन्दरः/वातकफज-भगन्दरः,-,the disorder is characterized by r̥ju [forms a straight fistula],-,bhagandara due to vāta and kapha,-
1010,1040,ED-16.7,arSo-BagandaraH kaPapitta-BagandaraH,arśō-bhagandaraḥ kaphapitta-bhagandaraḥ,अर्शो-भगन्दरः कफपित्त-भगन्दरः,-,"the disorder is characterized by śōphaḥ [oedema], kaṇḍūḥ [itching at anus], dāhaḥ [burning sensation], śīghrapākaḥ [suppurates quickly], pakvabhinnē arśasaḥ mūlaṁ klēdayati [on bursting of pile mass after suppuration, there is soddening at the base], ajasraṁ srāvaḥ [continous discharge]",-,bhagandara due to kapha and pitta,-
1011,1041,ED-16.8,SambUkAvarta-BagandaraH/sAnnipAtaja-BagandaraH,śambūkāvarta-bhagandaraḥ/sānnipātaja-bhagandaraḥ,शम्बूकावर्त-भगन्दरः/सान्निपातज-भगन्दरः,-,"the disorder is characterized by pādāṁguṣṭhapramāṇapiḍakā [nodule of a size of hallux], tōdaḥ [pricking pain], dāhaḥ [burning sensation], kaṇḍūḥ [itching], apratikriyamāṇā ca pākamupaiti [if it remains untreated suppuration results], nānāvidhavarṇāsrāvaḥ/bahuvarṇarujāsrāvaḥ [discharge with various /invariable colours], pūrṇanadīśambūkāvartavat/śmbūkāvartasannibhaḥ/śambūkāvartavat [like the ridges of a snail], gatayō dārayanti [tracts damaging soft tissues], gōstanōpama-piḍakā [boil looking like the teat of cow], bahurujā [different types of pain], bahuvarṇaḥ [different types of colour], bahusrāvaḥ [excessive/copious discharge]",-,bhagandara due to three dōṣa,-
1012,1042,ED-16.9,unmArgagAmI-BagandaraH/Salyajanya-BagandaraH/kShataja-BagandaraH,unmārgagāmī-bhagandaraḥ/śalyajanya-bhagandaraḥ/kṣataja-bhagandaraḥ,उन्मार्गगामी-भगन्दरः/शल्यजन्य-भगन्दरः/क्षतज-भगन्दरः,-,"the disorder is characterized by pūyarudhirāvakīrṇamāṁsakōthaḥ [purtrifaction of muscle associated with pus and blood], jalapraklinnāyāṁ bhūmāviva kr̥mayaḥ saṁjāyantē [like, worms are generated in moist soil], kr̥mibhiḥ pārśvatō gudadāraṇam/ kr̥mayaḥ paritō gudaṁ khādantī [microorganisms damaging soft tissue of anal region], kr̥mikr̥tairmārgaiḥ vātamūtrapurīṣarētāṁsi abhinissaranti [gases,urine,stool,semen are passed through the tracts created by micro organisms.]",-,bhagandara due to trauma,-
1013,1043,ED-16.10,asAdhya-BagandaraH,asādhya-bhagandaraḥ,असाध्य-भगन्दरः,-,-,-,incurable bhagandara,-
1014,1044,ED-16.11,Bagandara-ariShTalakShaNam,bhagandara-ariṣṭalakṣaṇam,भगन्दर-अरिष्टलक्षणम्,-,"the disorder is characterized by vātamūtrapurīṣakr̥mayaḥ bhagandarāt sravati [discharge of flatus, urine, feces and worms from fistula]",-,fatal signs of bhagandara,-
1015,1045,ED-17,davathuH,davathuḥ,दवथुः,-,-,-,burning sensation of sense organs,-
1016,1046,ED-18,SoNitakledaH,(a) śoṇitakledaḥ,शोणितक्लेदः,-,-,-,Hypoviscous blood disorder (TM2) ⇒,-
1017,1047,ED-19,snAyukarogaH,(a) snāyukarogaḥ,स्नायुकरोगः,-,"It is characterised by ulceration of eruptions, a red thread like worm comes out from it which is quite long and its length gradually increases. This may be explained by: (a) Unhygienic conditions leading to vitiation of kapha, blood, skin making susceptible for worm infestation.",-,Dracunculosis disorder (TM2),-
1018,1054,ED-20,dAhaH,dāhaḥ,दाहः,-,the disorder is characterized by sarvāṅgīṇastīvraḥ santāpō dāhaḥ [severe burning sensation in all over body],-,burning sensation,-
1019,1055,ED-20.1,raktajadAhaH,raktajadāhaḥ,रक्तजदाहः,-,"the disorder is characterized by uṣyatē [warmth], tāmralōcanaḥ [coppery lusture with copper red eyes], tāmrābhaḥ [coppery lusture skin], tr̥ṣyatē [thirst], lōhāngagandha angē [emits iron like odour from the body], lōhagandha-vadanaḥ [emits iron like odour from the mouth]",-,dāha due to rakta,-
1020,1056,ED-20.2,pittaja-dAhaH,pittaja-dāhaḥ,पित्तज-दाहः,-,the disorder is characterized by pitta jvara lakṣaṇapitta jvara lakṣaṇaḥ [symptoms similar to that of dāha],-,dāha due to pitta,-
1021,1057,ED-20.3,tRuShNA-nirodhajadAhaH,tr̥ṣṇā-nirōdhajadāhaḥ,तृष्णा-निरोधजदाहः,-,"the disorder is characterized by bāhyābhyantara-dēha-dāhaḥ [internal and external burning sensation], saṁśuṣka-galaḥ [dryness of throat], saṁśuṣka-tāluḥ [dryness of palate], saṁśuṣkōṣṭham [dryness of the lips], jihvāṁ niṣkr̥ṣya vēpanam [trumbling of tongue on protrusion], mandacētasaḥ [dulling of all senses]",-,dāha due to unquenched thirst,-
1022,1058,ED-20.4,asRukpUrNakoShThajadAhaH/raktapUrNakoShThajadAhaH,asr̥kpūrṇakōṣṭhajadāhaḥ/raktapūrṇakōṣṭhajadāhaḥ,असृक्पूर्णकोष्ठजदाहः/रक्तपूर्णकोष्ठजदाहः,-,-,-,dāha due to internal bleeding,-
1023,1059,ED-20.5,dhAtukShayajadAhaH,dhātukṣayajadāhaḥ,धातुक्षयजदाहः,-,"the disorder is characterized by kriyāhīnaḥ [diminution of activities], kṣāmasvaraḥ [weak and feeble voice], tr̥ṣṇā [thirst], bhr̥śapīḍitaḥ [excessively distressed], mūrcchāḥ [syncope/attacks of swooning], sīdēt [malaise]",-,dāha due to consumption,-
1024,1060,ED-20.6,kShatajadAhaH,kṣatajadāhaḥ,क्षतजदाहः,-,"the disorder is characterized by mūrcchā [syncope/attacks of swooning], pralāpa [excess talking/irrelevant speech/incoherent speech], tr̥ṣṇā [thirst], atyartha atyartha antardāhḥ [severe internal symptoms of burning]",-,dāha due to trauma,-
1025,1061,ED-20.7,marmABighAtajadAhaH,(a) marmābhighātajadāhaḥ,मर्माभिघातजदाहः,-,-,-,Burning sensation disorder due to trauma to vulnerable area (TM2) ⇒,-
1026,1062,EE,mAMsavahasrotovikAraH,māṁsavahasrōtōvikāraḥ,मांसवहस्रोतोविकारः,-,-,-,disorders of maMsavahasrOtas,-
1027,1063,EE-1,mAMsavahasrotoduShTiH,(a) māṃsavahasrotoduṣṭiḥ,मांसवहस्रोतोदुष्टिः,-,"It is characterized by swelling, varicose veins, death, emaciation of muscles, excessive growth in muscle tissue, tumour, goiter and cervical lymphadenitis. This may be explained by derangement of channels (functional or anatomical or both) carrying muscle tissue elements.",-,Derangement of channels enriching muscle tissue pattern (TM2),-
1028,1064,EE-2,arbudaH,(a) arbudaḥ,अर्बुदः,-,"It is characterised by uncontrolled spreading of swellings associated with multiple constitutional symptoms like weight loss, severe exhaustion. This may be explained by: (a) Involvement of all the three vitiated humours, seven elementary tissues.",-,Deep rooted spreading tumour disorder (TM2),-
1029,1065,EE-2.1,vAtaja-arbudaH,vātaja-arbudaḥ,वातज-अर्बुदः,-,"the disorder is characterized by accham asram (srāvaḥ) (bhinnē) [discharging transperent blood on bursting], āyamyatē [associated with stretching], kr̥ṣṇa-granthiḥ [black swelling], amr̥du-grathiḥ [swelling which is not soft/hard swelling], tudana (tudyatē) [associated with pricking sensation], pratyasyatē [a feeling of being thrown away], bastirivātataḥ/mr̥du bastirivānaddhaḥ [distended like a basti/urinary bladder], mr̥du bastirivātataḥ/mr̥du bastirivānaddhaḥ [soft swelling as bladder], bhidyatē [a feeling of being torn down], mathyati [a feeling of being churned up], amr̥du-grathiḥ [swelling which is not soft/hard swelling], vr̥ścyati [cutting type of pain], sthānāt sthānantara sthānāt sthānantara gatiḥ [moving from one site to another], akasmāt vr̥ddhi akasmāt vr̥ddhi hāniḥ [sudden regression or progression], vyathyatē [severe distress]",-,arbuda due to vāta,-
